ad_id,ad_type,advertiser,body,channels,collected_at,comments,cta,days_running,first_seen,has_store,heat,image_url,impressions,is_active,landing_page,last_seen,likes,platform,search_keyword,shares,source,title,total_engagement,video_duration,video_url
3962c57163d3eb328ba664b6f13f182c,image,Passion ***To Lovers,"« Tu es tout pour moi, Rosetta… » Leander murmurait cela contre ma gorge pendant qu’il me faisait l’amour, lentement et tendrement 🥵, mais il m’a volé mes fils jumeaux et laissé mon sexe vide et douloureux 🔥😣. À présent, je cours avec un médaillon qui crie que je suis la vraie reine 👑, et le seul homme qui peut me guérir est celui dont les bras m’ont portée comme si j’étais déjà sienne ❤️‍🔥. Quand Kyrell s’enfoncera enfin en moi, je le veux brutal—profond, cru, des coups de reins féconds qui me feront oublier chaque perte et me rappelleront exactement qui je suis née pour devenir 🖤.

Chapitre 1
Point de vue de Rosetta

Si je ne lui donne pas un héritier vivant cette fois-ci, mon cher mari se débarrassera de moi. Ou pire.

Parce qu’en tant que Prince Héritier de Reaton, Leander pouvait me f","facebook, instagram, audience_network, messenger",2026-04-12 10:55,0,Learn More,1,2026-04-12,True,49,https://sp.dataideaglobal.com/sp_opera/e8ea84edc04d0e9a0167cc1d3f9a71af.jpg,30666,True,,2026-04-12,0,facebook,dropshipping,0,bigspy,Continuer la lecture ➡️,0,0,
b11075b322a19378951ee2953e1c5d14,image,My Passi***ve Novels,"„Du bist mein Ein und Alles, Rosetta…“ Früher hat Leander mir das ins Genick geknurrt, während er mich langsam und süß gevögelt hat 🥵, aber er hat mir meine Zwillingssöhne gestohlen und meine Möse leer und schmerzhaft zurückgelassen 🔥😣. Jetzt bin ich auf der Flucht mit einem Medaillon, das schreit, ich bin die wahre Königin 👑, und der einzige Mann, der mich heilen kann, ist der, in dessen Armen ich mich schon wie sein Eigentum gefühlt habe ❤️‍🔥. Wenn Kyrell endlich in mich eindringt, will ich es brutal—tief, roh, zeugende Stöße, die mich jeden Verlust vergessen lassen und mich daran erinnern, wer ich geboren wurde zu sein 🖤.

Kapitel 1
Rosettas Sicht

Wenn ich ihm diesmal keinen lebenden Erben schenke, wird mein geliebter Ehemann mich loswerden. Oder schlimmeres.

Denn als Kronprinz von Re","facebook, instagram, audience_network, messenger",2026-04-12 10:55,0,Learn More,1,2026-04-12,True,49,https://sp.dataideaglobal.com/sp_opera/5c103a651f017f5505e8be18b7788d8a.jpg,30665,True,,2026-04-12,0,facebook,dropshipping,0,bigspy,Weiter lesen ➡️,0,0,
e07b761e5813037258cb4e46ddbafb8c,image,My Passio***ers Tales,"“You gave birth to stillborns,” they said. “Everything you remember is grief.” I heard my sons cry in my arms—and they called it madness 😡. They rewrote my reality, turned my truth into a lie, and handed my children to my husband’s other wife as if I never existed 💔. Every servant looks at me with pity, every noble whispers that I’ve lost my mind… but I remember the warmth of my baby against my chest, the mark that proves he is mine 🔥. They can strip me of my title, my place, even my name—but they can’t erase a mother’s memory. And I will make them regret ever trying 😤👑. Chapter 1 Rosetta’s POV If I don't give him a living heir this time, my beloved husband will get rid of me. Or worse.  Because, as a Crown Prince of Reaton, Leander could do to me whatever he’d please.  Because I’m the wif","facebook, instagram, audience_network, messenger",2026-04-12 10:55,0,Learn More,1,2026-04-12,True,49,https://sp.dataideaglobal.com/sp_opera/4c1a78972dcf4c9486c9d0255ee0c592.jpg,30649,True,,2026-04-12,0,facebook,dropshipping,0,bigspy,Continue reading ➡️,0,0,
41bba72ffd89b9ca99ed6576c8ef786b,image,My Passio***ers Tales,"Ihre Perspektive: Ich habe mit meinen eigenen Händen ein Imperium aufgebaut… und musste zusehen, wie mein Ehemann sich dafür all die Anerkennung einheimste 💔. Jahrelang spielte ich die gehorsame Ehefrau, während er mich im Verborgenen benutzte, kontrollierte und zerbrach 😣. Doch in der Nacht, als er mich durch seine Geliebte ersetzte und mir mein Geburtsrecht raubte, brach etwas in mir entzwei 🔥. Ich floh – mit nichts als Geheimnissen und einem Plan. Jetzt verstecke ich mich an dem letzten Ort, an dem er mich je vermuten würde… an der Seite des Mannes, den ich einst liebte, dessen Leben ich heimlich zerstört habe 😭. Ich bin zurückgekehrt, um zu überleben. Aber diesmal… hole ich mir alles zurück 👑🔥.

Kapitel 1
Renées Perspektive

„Der Château Margaux gehört nach links, nicht nach rechts. Es","facebook, instagram, audience_network, messenger",2026-04-12 10:55,0,Learn More,1,2026-04-12,True,49,https://sp.dataideaglobal.com/sp_opera/477ccbc91a20be1ac08f66775229790e.jpg,30632,True,,2026-04-12,0,facebook,dropshipping,0,bigspy,Weiter lesen ➡️,0,0,
492b4061c2845f06d1e5135e14c3db19,image,My Passi***ve Novels,"Il suo punto di vista: Ho passato tutta la vita a essere la gemella indesiderata—quella senza un lupo, senza potere, senza valore 💔. Ma quando mia sorella perfetta è morta, i miei genitori mi hanno dato una sola scelta: diventare lei… o restare un niente 🩸. Ora indosso il suo volto, sto per sposare il suo fidanzato Alpha, e spio proprio l’uomo che dovrei tradire 🐺🔥. Matthias Henderson doveva essere il mio nemico—ma nel momento in cui mi ha toccata, qualcosa dentro di me si è spezzato e aperto ❤️‍🔥. Questo non era parte del piano. Lui mi guarda come se contassi qualcosa. Come se fossi sua. Ma se scopre chi sono davvero… non solo mi odierà. Mi distruggerà 💣.

capitolo 1
POV Blake
Sai cosa c’è di peggio che essere la delusione della famiglia? Essere costantemente ricordato di esserlo mentre m","facebook, instagram, audience_network, messenger",2026-04-12 10:55,0,Learn More,1,2026-04-12,True,49,https://sp.dataideaglobal.com/sp_opera/fabe2f3bfdda395f2b49cf8aef0a1fbb.jpg,30631,True,,2026-04-12,0,facebook,dropshipping,0,bigspy,Continua a leggere ➡️,0,0,
0539b5f711ccc8a52cb2cc4320c4a452,image,My Passi***ve Novels,"„Jesteś w ciąży… i nawet nie wiesz, które z nas jest ojcem.” Myślałam, że najgorsze minęło po tamtej nocy 😔. Dostałam pieniądze. Moja mama przeżyła ❤️. Odeszłam. Ale moje ciało nie 💔. Teraz noszę w sobie dziecko, które może zmienić wszystko — i nawet nie wiem, który z nich jest ojcem 😫. Ci sami mężczyźni, których próbowałam zapomnieć, są teraz ze mną związani w sposób, od którego nie mogę się uwolnić 🔥. A w świecie, gdzie linia krwi oznacza władzę… moje dziecko może być najcenniejszą rzeczą, jaką mam — albo najniebezpieczniejszą 🖤.

Rozdział 1
[Perspektywa Bailee]

""Przykro nam z powodu pani straty, pani..."" Pauza się przeciąga — sekunda, dwie — oczy prawnika zerkają na kartkę na stole, skanują, wracają. „…Reed.” Oto jest. Ta pół sekundy, gdy moje nazwisko wymagało sprawdzenia w dokumentac","facebook, instagram, audience_network, messenger",2026-04-12 10:55,0,Learn More,1,2026-04-12,True,49,https://sp.dataideaglobal.com/sp_opera/af031c8998cdfd13a17c4d0eec3b4a64.jpg,30629,True,,2026-04-12,0,facebook,dropshipping,0,bigspy,Kontynuuj czytanie ➡️,0,0,
d4e14145ccb39b112fb633760a8c8848,image,My Passi***ve Novels,"“Sei incinta… e non sai nemmeno di chi di noi sia.” Pensavo che il peggio fosse passato dopo quella notte 😔. Ho ottenuto i soldi. Mia madre è sopravvissuta ❤️. Me ne sono andata. Ma il mio corpo no 💔. Ora porto in grembo un bambino che potrebbe cambiare tutto—e non so nemmeno chi sia il padre 😫. Gli stessi uomini che ho cercato di dimenticare ora sono legati a me in un modo da cui non posso fuggire 🔥. E in un mondo in cui la discendenza significa potere… mio figlio potrebbe essere la cosa più preziosa che possiedo—o la più pericolosa 🖤.

Capitolo 1

[Punto di vista di Bailee]

""Ci dispiace per la sua perdita, signorina…"" La pausa si prolunga—un secondo, due—gli occhi dell’avvocato scivolano su un foglio sul tavolo, leggono, poi tornano su di me. ""…Reed."" Ecco. Il mezzo secondo in cui il mi","facebook, instagram, audience_network, messenger",2026-04-12 10:55,0,Learn More,1,2026-04-12,True,49,https://sp.dataideaglobal.com/sp_opera/4899c0ccec9876f7bc95d2c796235c9a.jpg,30628,True,,2026-04-12,0,facebook,dropshipping,0,bigspy,Continua a leggere ➡️,0,0,
29b339a469bde7078bfd9f4de8094642,image,Passion ***n Romance,"« Où qu'elle soit… j'espère qu'elle souffre. » Je me suis figée lorsqu'il a prononcé ces mots—parce qu'il parlait de moi 😭. L'homme qui m'a sauvée ignorait que j'étais celle qui avait ruiné sa famille, celle qui avait détruit son vignoble 💔. Maintenant, je vis sous son toit, je travaille à ses côtés, cachée derrière un faux nom pendant qu'il me regarde comme si j'étais quelqu'un digne de confiance 🥺. Il se souvient de la fille qu'il a autrefois aimée… mais il ne la reconnaît pas en moi. Et s'il découvre un jour la vérité… je ne perdrai pas seulement lui—je perdrai tout 🔥.

Chapitre 1
Point de vue de Renée

« Le Château Margaux va à gauche, pas à droite. À moins que tu ne veuilles que nos invités pensent qu’on sert du bordeaux avec le poisson comme des sauvages. »

Le serveur se fige en ple","facebook, instagram, audience_network, messenger",2026-04-12 10:55,0,Learn More,1,2026-04-12,True,49,https://sp.dataideaglobal.com/sp_opera/3088d7c08b7742d9788af717029484b7.jpg,30628,True,,2026-04-12,0,facebook,dropshipping,0,bigspy,Continuer la lecture ➡️,0,0,
5b4086b7e8fd43f8e88cbb05040d0ba1,image,My Passi***ve Novels,"“You made me desperate… now you’ll watch me become unstoppable.” They humiliated me, reduced me to nothing, and forced me into a choice that cost me everything 💔. But I survived 🔥. I turned desperation into power, shame into leverage, and now I hold something none of them can ignore—a future they never saw coming 😈. I was the half-blood janitor they laughed at… but now I’m the woman they can’t control ❤️‍🔥. And this time? I’m not the one being hunted. I’m the one rewriting the rules 🖤🔥. Chapter 1  [Bailee’s POV]  ""We're sorry for your loss, Ms…"" The pause stretches—one second, two—the lawyer's eyes flick to a sheet on the table, scan, return. ""…Reed."" There it is. The half-second where my last name required a cross-reference. Across the table, a junior associate marks something in his marg","facebook, instagram, audience_network, messenger",2026-04-12 10:55,0,Learn More,1,2026-04-12,True,49,https://sp.dataideaglobal.com/sp_opera/80be47f3fb3640425fa8823fa9b7fd9c.jpg,30624,True,,2026-04-12,0,facebook,dropshipping,0,bigspy,Continue reading ➡️,0,0,
f9c044631fee64c8e5be736bfd21f258,image,Passion ***n Romance,"“You gave birth to stillborns,” they said. “Everything you remember is grief.” I heard my sons cry in my arms—and they called it madness 😡. They rewrote my reality, turned my truth into a lie, and handed my children to my husband’s other wife as if I never existed 💔. Every servant looks at me with pity, every noble whispers that I’ve lost my mind… but I remember the warmth of my baby against my chest, the mark that proves he is mine 🔥. They can strip me of my title, my place, even my name—but they can’t erase a mother’s memory. And I will make them regret ever trying 😤👑. Chapter 1 Rosetta’s POV If I don't give him a living heir this time, my beloved husband will get rid of me. Or worse.  Because, as a Crown Prince of Reaton, Leander could do to me whatever he’d please.  Because I’m the wif","facebook, instagram, audience_network, messenger",2026-04-12 10:55,0,Learn More,1,2026-04-12,True,49,https://sp.dataideaglobal.com/sp_opera/71e358cfec19cc40f1b3ccff1f637c89.jpg,30623,True,,2026-04-12,0,facebook,dropshipping,0,bigspy,Continue reading ➡️,0,0,
1b1a9563ac579961afd9326f20b06500,image,Passion***ce Books,"« Reste avec moi. Tu vas t'en sortir. » La voix grave de Kyrell m'enveloppait alors que j’étais à demi-morte dans la poussière, mais maintenant je suis vivante et affamée—mon ventre vide, mon clitoris palpitant pour le premier homme qui m’a fait me sentir à la fois en sécurité et souillée 😫🔥. Je le laisserai s’approprier chaque orifice, me remplir de sperme chaud et épais jusqu’à ce que ça coule le long de mes cuisses, puis utiliser le secret de ce médaillon 🎖️ pour reprendre mes fils volés et chevaucher la verge du nouveau roi 🍆 tandis que l’ancien regarde son trône s’effondrer 👑❤️‍🔥.

Chapitre 1

Point de vue de Rosetta

Si je ne lui donne pas un héritier vivant cette fois, mon bien-aimé mari se débarrassera de moi. Ou pire. 
Car, en tant que prince héritier de Réaton, Leander pourrait m","facebook, instagram, audience_network, messenger",2026-04-12 10:55,0,Learn More,1,2026-04-12,True,49,https://sp.dataideaglobal.com/sp_opera/6ebc6c3108bbdabde380f7e185ddde0e.jpg,30595,True,,2026-04-12,0,facebook,dropshipping,0,bigspy,Continuer la lecture ➡️,0,0,
616acdf15c691889906730235044af3f,image,Pass***nce ,"«Dimmi chi ti ha fatto questo… e gliela farò pagare.» Quando non avevo più nulla—nessun titolo, nessun figlio, nessun posto nel mondo—lui mi ha trovata 🖤. Uno sconosciuto che non mi guardava come se fossi rotta… ma come se valesse la pena salvarmi ❤️‍🔥. Mi ha creduto quando nessun altro lo faceva. Mi ha offerto protezione, non pietà. E per la prima volta da quando mi avevano portato via tutto, ho sentito qualcosa cambiare dentro di me 🔥. Non solo dolore. Non solo sofferenza. Ma uno scopo. Perché non sono solo una moglie scartata o una madre in lutto… Sono qualcosa di più. E quando risorgerò, non solo riprenderò i miei figli—distruggerò tutti coloro che hanno cercato di cancellarmi 🔥👑.

Capitolo 1
POV di Rosetta

Se questa volta non gli do un erede vivente, mio marito adorato mi manderà via","facebook, instagram, audience_network, messenger",2026-04-12 10:55,0,Learn More,1,2026-04-12,True,49,https://sp.dataideaglobal.com/sp_opera/14281fa086f0b3d0e8394ffccab36a72.jpg,30582,True,,2026-04-12,0,facebook,dropshipping,0,bigspy,Continua a leggere ➡️,0,0,
cedb13a8c923f83f1aee7e74e18ebc9d,image,Pass***nce ,"„Zbudowałam to imperium… a dziś wieczorem oddałeś je swojej kochance.” Oklaski jeszcze nie ucichły, gdy wypowiada jej imię. „Mademoiselle Sandrine Béliveau.” Przez chwilę nie rozumiem tych słów. Zawisły w powietrzu niczym obcy język, coś, co powinnam rozpoznać, ale nie potrafię. Potem ona wychodzi przed szereg. Blondynka. Uśmiechnięta. Dwadzieścia dwa lata. Siedzi na miejscu, które wypracowałam. Sala wybucha—oklaski, śmiech, brzęk kieliszków szampana, jakby nic właśnie nie umarło na ich oczach. Mój kieliszek wypada mi z ręki i roztrzaskuje się na marmurze. Głowy się odwracają. Dobrze.

„Powiedz mi, że to żart,” mówię, a mój głos przecina hałas jak brzytwa. Frank nie patrzy na mnie jak mąż. Patrzy jak na problem.

„Renée,” mówi łagodnie, ostrzegawczo. „Nie tutaj.”

Nie tutaj. Nie po ośmiu l","facebook, instagram, audience_network, messenger",2026-04-12 10:55,0,Learn More,1,2026-04-12,True,49,https://sp.dataideaglobal.com/sp_opera/661911f68bb25d1cf0f535d18e001468.jpg,30572,True,,2026-04-12,0,facebook,dropshipping,0,bigspy,Kontynuuj czytanie ➡️,0,0,
64ec1ade500fdc56c4651d164a85f2eb,image,Re***alk,UPTO 50% OFF,"facebook, instagram, messenger",2026-04-12 10:55,0,Shop Now,1,2026-04-12,True,49,https://sp.dataideaglobal.com/sp_opera/c5bc553311111e23d3702a7fe21668b3.jpg,26312,True,,2026-04-12,0,facebook,dropshipping,0,bigspy,"NOW:PKR1,950/-
WAS:PKR3,900/-",0,0,
f9fe225c15f4757f4f900dcb3220b9c0,image,My Passi***ve Novels,"« Tu es enceinte… et tu ne sais même pas lequel de nous deux est le père. » Je croyais que le pire était derrière moi après cette nuit-là 😔. J’ai eu l’argent. Ma mère a survécu ❤️. Je suis partie. Mais mon corps, lui, ne s’en est pas remis 💔. Maintenant, je porte un enfant qui pourrait tout changer — et je ne sais même pas lequel d’entre eux est le père 😫. Les mêmes hommes que j’essayais d’oublier sont désormais liés à moi d’une façon dont je ne peux pas m’échapper 🔥. Et dans un monde où la lignée signifie le pouvoir… mon enfant pourrait bien être la chose la plus précieuse que je possède — ou la plus dangereuse 🖤.

Chapitre 1  [Point de vue de Bailee]

« Nous sommes désolés pour votre perte, Mlle… » La pause s’étire — une seconde, deux — les yeux de l’avocat glissent vers une feuille posé","facebook, instagram, audience_network, messenger",2026-04-12 10:55,0,Learn More,1,2026-04-12,True,49,https://sp.dataideaglobal.com/sp_opera/eaa991d5220bb15e49cb166afbe01c3e.jpg,26286,True,,2026-04-12,0,facebook,dropshipping,0,bigspy,Continuer la lecture ➡️,0,0,
17b5d6151e2c212214f5fda7849ccc36,image,Special Creative,Excellent Creative not to be missed,"facebook, instagram, audience_network, messenger",2026-04-12 10:55,0,Learn More,2,2026-04-12,True,49,https://sp.dataideaglobal.com/sp_opera/f67af4d1b8dfd73a82bf84d78a5ad123.jpg,26278,True,,2026-04-12,0,facebook,dropshipping,0,bigspy,Special Creative,0,0,
343b886edbdd75d0eb047788fa01c046,image,Special Creative,Excellent Creative not to be missed,"facebook, instagram, audience_network, messenger",2026-04-12 10:55,0,Learn More,2,2026-04-12,True,49,https://sp.dataideaglobal.com/sp_opera/f313588035f96495f56db000f8eedc81.jpg,26243,True,,2026-04-12,0,facebook,dropshipping,0,bigspy,Special Creative,0,0,
de459f8dd9106be7114204b4e329ef76,image,Special Creative,Excellent Creative not to be missed,"facebook, instagram, audience_network, messenger",2026-04-12 10:55,0,Learn More,2,2026-04-12,True,49,https://sp.dataideaglobal.com/sp_opera/00a7d0533e0d74cf357710188357d340.jpg,26239,True,,2026-04-12,0,facebook,dropshipping,0,bigspy,Special Creative,0,0,
a93127893fa734541633c5585d72292e,image,Special Creative,Excellent Creative not to be missed,"facebook, instagram, audience_network, messenger",2026-04-12 10:55,0,Learn More,2,2026-04-12,True,49,https://sp.dataideaglobal.com/sp_opera/c6f2e0755cd7ce9333d969e2524a60c1.jpg,26183,True,,2026-04-12,0,facebook,dropshipping,0,bigspy,Special Creative,0,0,
edcca325c445626d818286f5331f8593,image,Special Creative,Excellent Creative not to be missed,"facebook, instagram, messenger",2026-04-12 10:55,0,Apply Now,2,2026-04-12,True,49,https://sp.dataideaglobal.com/sp_opera/5414b5ca8cd8ebd3c2abf50757b028cc.jpg,21884,True,,2026-04-12,0,facebook,dropshipping,0,bigspy,Special Creative,0,0,
a1a830ada448ca1e89e02df3293e4cec,image,Special Creative,Excellent Creative not to be missed,"facebook, instagram, messenger",2026-04-12 10:55,0,Apply Now,2,2026-04-12,True,49,https://sp.dataideaglobal.com/sp_opera/a6b0b82b1fa08907fb28ffb339ef27cf.jpg,21840,True,,2026-04-12,0,facebook,dropshipping,0,bigspy,Special Creative,0,0,
f3062cbfd1a027806703760e97090b0b,image,Special Creative,Excellent Creative not to be missed,"facebook, instagram, audience_network",2026-04-12 10:55,0,Shop Now,2,2026-04-12,True,49,https://sp.dataideaglobal.com/sp_opera/70863add325e643b90560e567b9bc4d5.jpg,18649,True,,2026-04-12,0,facebook,dropshipping,0,bigspy,Special Creative,0,0,
b5f184ab2653316e8785d2c632add706,image,Special Creative,Excellent Creative not to be missed,"facebook, instagram",2026-04-12 10:55,0,Whatsapp Message,2,2026-04-12,True,49,https://sp.dataideaglobal.com/sp_opera/25850b2841486195856982b6b8d0089f.jpg,17515,True,,2026-04-12,0,facebook,dropshipping,0,bigspy,Special Creative,0,0,
af4f3a8596f96839ca72b0a99b71f8e9,image,Special Creative,Excellent Creative not to be missed,"facebook, instagram, audience_network, messenger",2026-04-12 10:55,0,Download,2,2026-04-12,True,49,https://sp.dataideaglobal.com/sp_opera/2e31884f9977c877bf2b3fa501f31594.jpg,17494,True,,2026-04-12,0,facebook,dropshipping,0,bigspy,Special Creative,0,0,
0b8b4c5c3d20a79460b3763026a267a9,image,Special Creative,Excellent Creative not to be missed,"facebook, instagram, audience_network, messenger",2026-04-12 10:55,0,Download,2,2026-04-12,True,49,https://sp.dataideaglobal.com/sp_opera/7917af58d473241b4c1321d00e99f7ee.jpg,17481,True,,2026-04-12,0,facebook,dropshipping,0,bigspy,Special Creative,0,0,
26e3b53b1e0c42eca8e3a562ba060b03,video,Special Creative,Excellent Creative not to be missed,"facebook, instagram, audience_network, messenger",2026-04-12 10:55,0,Shop Now,2,2026-04-12,True,49,https://sp.dataideaglobal.com/sp_opera/d96abc7d88a8e8cfc47c65fd6e55938a.jpg,17477,True,,2026-04-12,0,facebook,dropshipping,0,bigspy,Special Creative,0,14,https://sp.dataideaglobal.com/sp_opera/f8eab3081de41e1e0e414d70423fb48e.mp4
43da15df3b0bf7ec2227788e07e2aeee,image,Special Creative,Excellent Creative not to be missed,"facebook, instagram, audience_network, messenger",2026-04-12 10:55,0,Learn More,2,2026-04-12,True,49,https://sp.dataideaglobal.com/sp_opera/166476899b41baa926988c7022e65f72.jpg,17464,True,,2026-04-12,0,facebook,dropshipping,0,bigspy,Special Creative,0,0,
ffaa59f3e3b9d21729aa36aa6594c138,image,Special Creative,Excellent Creative not to be missed,"facebook, instagram, audience_network, messenger",2026-04-12 10:55,0,Download,2,2026-04-12,True,49,https://sp.dataideaglobal.com/sp_opera/37baa27449bf8166cd66a6ff2a0e58c3.jpg,13142,True,,2026-04-12,0,facebook,dropshipping,0,bigspy,Special Creative,0,0,
fab5566b27df63f9c5a25f06f997537a,image,Special Creative,Excellent Creative not to be missed,"facebook, instagram, audience_network, messenger",2026-04-12 10:55,0,Download,2,2026-04-12,True,49,https://sp.dataideaglobal.com/sp_opera/5e2e33adeef0c12f9664363db3b6bd6d.jpg,13134,True,,2026-04-12,0,facebook,dropshipping,0,bigspy,Special Creative,0,0,
7c2ae1a0c194bc73d76a138f9b9c8580,image,Special Creative,Excellent Creative not to be missed,"facebook, instagram, audience_network, messenger",2026-04-12 10:55,0,Download,2,2026-04-12,True,49,https://sp.dataideaglobal.com/sp_opera/c7c9a1e21c21cbdffbc87cfc2a1c8652.jpg,13130,True,,2026-04-12,0,facebook,dropshipping,0,bigspy,Special Creative,0,0,
bebf5217b49dc82b32bedfaef59238e5,image,Special Creative,Excellent Creative not to be missed,"facebook, instagram",2026-04-12 10:55,0,Shop Now,2,2026-04-12,True,49,https://sp.dataideaglobal.com/sp_opera/4c85852e04efe3e56ef2cef732918e24.jpg,13126,True,,2026-04-12,0,facebook,dropshipping,0,bigspy,Special Creative,0,0,
079c1dd1691cc1bced9c82a9027e4c3b,image,Special Creative,Excellent Creative not to be missed,facebook,2026-04-12 10:55,0,Learn More,2,2026-04-12,True,49,https://sp.dataideaglobal.com/sp_opera/80a7b818eba9b477e4d9b8262e6f32e6.jpg,13122,True,,2026-04-12,0,facebook,dropshipping,0,bigspy,Special Creative,0,0,
331f5afbc7efebb5ba7520c68f8de6c3,image,Special Creative,Excellent Creative not to be missed,"facebook, instagram, audience_network, messenger",2026-04-12 10:55,0,Download,2,2026-04-12,True,49,https://sp.dataideaglobal.com/sp_opera/781885f9c00f41296cf9bbd366e50d38.jpg,13108,True,,2026-04-12,0,facebook,dropshipping,0,bigspy,Special Creative,0,0,
977dd0599c75734d4a1a7a38e08ca34f,image,Special Creative,Excellent Creative not to be missed,"facebook, instagram",2026-04-12 10:55,0,Learn More,2,2026-04-12,True,49,https://sp.dataideaglobal.com/sp_opera/1208f93a80c77cdbdd09deccdaa8e98b.jpg,13100,True,,2026-04-12,0,facebook,dropshipping,0,bigspy,Special Creative,0,0,
7f58de4613ade88bb8ee99efde2ddf99,image,Special Creative,Excellent Creative not to be missed,facebook,2026-04-12 10:55,0,Contact Us,2,2026-04-12,True,49,https://sp.dataideaglobal.com/sp_opera/ab6aeab1fed33650802c82955a6ff5f1.jpg,13100,True,,2026-04-12,0,facebook,dropshipping,0,bigspy,Special Creative,0,0,
fe74ea40fc94f5b64da692f1968cd3ab,image,Special Creative,Excellent Creative not to be missed,"facebook, instagram, audience_network, messenger",2026-04-12 10:55,0,Learn More,2,2026-04-12,True,50,https://sp.dataideaglobal.com/sp_opera/6dc5167c0f551ffbcc9ae7c17e15f746.jpg,9957,True,,2026-04-12,0,facebook,dropshipping,0,bigspy,Special Creative,0,0,
68b1e018b831133c70989ebed9ad080f,image,Special Creative,Excellent Creative not to be missed,"facebook, instagram, audience_network, messenger",2026-04-12 10:55,0,Learn More,2,2026-04-12,True,50,https://sp.dataideaglobal.com/sp_opera/6dc5167c0f551ffbcc9ae7c17e15f746.jpg,9949,True,,2026-04-12,0,facebook,dropshipping,0,bigspy,Special Creative,0,0,
ee493841d4bb1b374a678748a2649c3c,image,Special Creative,Excellent Creative not to be missed,"facebook, instagram, audience_network, messenger",2026-04-12 10:55,0,Learn More,2,2026-04-12,True,50,https://sp.dataideaglobal.com/sp_opera/abe6166f9fcdd04aeb730a0803acd70f.jpg,9559,True,,2026-04-12,0,facebook,dropshipping,0,bigspy,Special Creative,0,0,
4a8503e1b717c5d9f8fd4edd9194322e,image,Special Creative,Excellent Creative not to be missed,"facebook, instagram, audience_network, messenger",2026-04-12 10:55,0,Learn More,2,2026-04-12,True,50,https://sp.dataideaglobal.com/sp_opera/abe6166f9fcdd04aeb730a0803acd70f.jpg,9546,True,,2026-04-12,0,facebook,dropshipping,0,bigspy,Special Creative,0,0,
f0851a729248dcc59cfe39f40c300dec,image,Special Creative,Excellent Creative not to be missed,"facebook, instagram, messenger",2026-04-12 10:55,0,Download,2,2026-04-12,True,50,https://sp.dataideaglobal.com/sp_opera/bca6835dc89c9dacf8b5ccfa2a502a7f.jpg,9345,True,,2026-04-12,0,facebook,dropshipping,0,bigspy,Special Creative,0,0,
46f3070dac8d5a095288a33d09776d82,image,Special Creative,Excellent Creative not to be missed,"facebook, instagram, audience_network, messenger",2026-04-12 10:55,0,Get Quote,2,2026-04-12,True,50,https://sp.dataideaglobal.com/sp_opera/da884cfc280f6b4eab2036a7e96bc378.jpg,9076,True,,2026-04-12,0,facebook,dropshipping,0,bigspy,Special Creative,0,0,
